computer_systems/c computer systems/results/linkedlist.csv

list_bytes,list_kb,ns_per_hop
4096,4.0000,0.656250
8192,8.0000,0.654000
16384,16.0000,0.657000
32768,32.0000,0.653792
65536,64.0000,0.666293
131072,128.0000,0.665043
262144,256.0000,2.603500
524288,512.0000,2.901922
1048576,1024.0000,3.518277
2097152,2048.0000,6.173806
4194304,4096.0000,6.696607
8388608,8192.0000,7.253011
16777216,16384.0000,9.520213
33554432,32768.0000,37.200655
67108864,65536.0000,69.235802
134217728,131072.0000,76.093674
268435456,262144.0000,83.335876

computer_systems/c computer systems/src/output.md

4 KB  64 nodes -> 0.6562 ns/hop
  8 KB  128 nodes -> 0.6540 ns/hop
  16 KB  256 nodes -> 0.6570 ns/hop
  32 KB  512 nodes -> 0.6538 ns/hop
  64 KB  1024 nodes -> 0.6663 ns/hop
  128 KB  2048 nodes -> 0.6650 ns/hop
  256 KB  4096 nodes -> 2.6035 ns/hop
  512 KB  8192 nodes -> 2.9019 ns/hop
  1024 KB  16384 nodes -> 3.5183 ns/hop
  2048 KB  32768 nodes -> 6.1738 ns/hop
  4096 KB  65536 nodes -> 6.6966 ns/hop
  8192 KB  131072 nodes -> 7.2530 ns/hop
  16384 KB  262144 nodes -> 9.5202 ns/hop
  32768 KB  524288 nodes -> 37.2007 ns/hop
  65536 KB  1048576 nodes -> 69.2358 ns/hop
  131072 KB  2097152 nodes -> 76.0937 ns/hop
  262144 KB  4194304 nodes -> 83.3359 ns/hop
  Results saved to results/linkedlist.csv